[
  {
    "ts": "2025-01-10T12:00:00Z",
    "type": "belief",
    "tags": [
      "reflection",
      "outcomes"
    ],
    "summary": "Recent outcomes show more wins (2) than losses (1).",
    "data": {
      "belief_type": "outcome_balance",
      "confidence": 0.65,
      "counts": {
        "decisions": 2,
        "outcomes": 3
      },
      "evidence_ids": [
        "out_1",
        "out_2",
        "out_3"
      ],
      "metrics": {
        "losses": 1,
        "total": 3,
        "unknown": 0,
        "wins": 2
      },
      "time_window": {
        "from": "2025-01-03T12:00:00Z",
        "to": "2025-01-10T12:00:00Z"
      }
    },
    "source": {
      "system": "jax-reflection"
    }
  },
  {
    "ts": "2025-01-10T12:00:00Z",
    "type": "belief",
    "tags": [
      "reflection",
      "pattern",
      "earnings"
    ],
    "summary": "Pattern: tag \"earnings\" appears in 4 recent decisions/outcomes.",
    "data": {
      "belief_type": "tag_pattern",
      "confidence": 0.7,
      "evidence_ids": [
        "dec_1",
        "dec_2",
        "out_1",
        "out_3"
      ],
      "metrics": {
        "count": 4,
        "tag": "earnings"
      },
      "time_window": {
        "from": "2025-01-03T12:00:00Z",
        "to": "2025-01-10T12:00:00Z"
      }
    },
    "source": {
      "system": "jax-reflection"
    }
  }
]
